<?xml version="1.0" encoding="UTF-8"?>
<xsd:schema xmlns:xsd="http://www.w3.org/2001/XMLSchema" xmlns:od="urn:schemas-microsoft-com:officedata">
<xsd:element name="dataroot">
<xsd:complexType>
<xsd:sequence>
<xsd:element ref="tb_GuysStThomas_Predecessors" minOccurs="0" maxOccurs="unbounded"/>
</xsd:sequence>
<xsd:attribute name="generated" type="xsd:dateTime"/>
</xsd:complexType>
</xsd:element>
<xsd:element name="tb_GuysStThomas_Predecessors">
<xsd:annotation>
<xsd:appinfo>
<od:index index-name="PrimaryKey" index-key="lID " primary="yes" unique="yes" clustered="no"/>
<od:index index-name="ID" index-key="lID " primary="no" unique="no" clustered="no"/>
<od:index index-name="PredecessorID" index-key="lPredecessorID " primary="no" unique="no" clustered="no"/>
<od:index index-name="TaskID" index-key="lSuccessorID " primary="no" unique="no" clustered="no"/>
</xsd:appinfo>
</xsd:annotation>
<xsd:complexType>
<xsd:sequence>
<xsd:element name="lID" minOccurs="1" od:jetType="autonumber" od:sqlSType="int" od:autoUnique="yes" od:nonNullable="yes" type="xsd:int"/>
<xsd:element name="lPredecessorID" minOccurs="0" od:jetType="longinteger" od:sqlSType="int" type="xsd:int"/>
<xsd:element name="lSuccessorID" minOccurs="0" od:jetType="longinteger" od:sqlSType="int" type="xsd:int"/>
<xsd:element name="yType" minOccurs="0" od:jetType="longinteger" od:sqlSType="int" type="xsd:int"/>
<xsd:element name="lLagFactor" minOccurs="0" od:jetType="longinteger" od:sqlSType="int" type="xsd:int"/>
<xsd:element name="yLagInterval" minOccurs="0" od:jetType="longinteger" od:sqlSType="int" type="xsd:int"/>
</xsd:sequence>
</xsd:complexType>
</xsd:element>
</xsd:schema>
